{
  "code": 200,
  "data": {
    "viewmeta": {
      "billid": 1008914277,
      "cBillName": "职务",
      "cBillNameResid": "P_YS_PF_GZTSYS_0000012632",
      "cBillType": "Archive",
      "cBillNo": "duty",
      "bAllowMultiTpl": false,
      "cSubId": "staff",
      "cCardKey": "duty",
      "view": {
        "iTplId": 15374559,
        "cTemplateName": "职务详情",
        "iTplMode": 2,
        "iWidth": 1000,
        "cTemplateTitle": "职务",
        "cTitle_resid": "P_YS_PF_GZTSYS_0000012632",
        "containers": [
          {
            "groupId": 147288616,
            "cName": "headtoolbar",
            "iOrder": 0,
            "bMain": true,
            "cCode": "duty",
            "cDataSourceName": "bd.duty.Duty",
            "cControlType": "CardHeader",
            "cGroupCode": "headtoolbar",
            "cAlign": "top",
            "iCols": 0
          },
          {
            "groupId": 34659315953,
            "cName": "footertoolbar",
            "iOrder": 0,
            "cDataSourceName": "Toolbar",
            "cControlType": "Toolbar",
            "cGroupCode": "footertoolbar",
            "cAlign": "right",
            "iCols": 0,
            "cStyle": "{\"classname\":\"btn-group-bottom bottom-toolbar\"}",
            "controls": [
              {
                "cItemName": "btnAbandon",
                "cCaption": "取消",
                "cCaptionResid": "P_YS_FED_EXAMP_0000020385",
                "cShowCaption": "取消",
                "cShowCaptionResid": "P_YS_FED_EXAMP_0000020385",
                "bEnum": false,
                "cControlType": "button",
                "iOrder": 3,
                "iStyle": 1,
                "enterDirection": 0,
                "bEnableFormat": false,
                "key": "34659315953"
              },
              {
                "cItemName": "btnSaveAndAdd",
                "cCaption": "保存并新增",
                "cCaptionResid": "P_YS_FED_UCFBASEDOC_0000024712",
                "cShowCaption": "保存并新增",
                "cShowCaptionResid": "P_YS_FED_UCFBASEDOC_0000024712",
                "bEnum": false,
                "cControlType": "primarybutton",
                "iOrder": 4,
                "iStyle": 1,
                "enterDirection": 0,
                "bEnableFormat": false,
                "key": "34659315952"
              },
              {
                "cItemName": "btnSave",
                "cCaption": "保存",
                "cCaptionResid": "P_YS_PF_GZTSYS_0000013477",
                "cShowCaption": "保存",
                "cShowCaptionResid": "P_YS_PF_GZTSYS_0000013477",
                "bEnum": false,
                "cControlType": "primarybutton",
                "iOrder": 5,
                "iStyle": 1,
                "enterDirection": 0,
                "bEnableFormat": false,
                "key": "34659315951"
              }
            ],
            "key": "ContainerToolbarfootertoolbar",
            "parentKey": "footertoolbar"
          },
          {
            "groupId": 147288617,
            "cName": "duty",
            "iOrder": 3,
            "bMain": true,
            "cCode": "duty",
            "cDataSourceName": "bd.duty.Duty",
            "cControlType": "div",
            "cGroupCode": "duty",
            "cAlign": "top",
            "iCols": 2,
            "cStyle": "{\"classname\":\"padd-bottom-60\"}",
            "controls": [
              {
                "cItemName": "code",
                "cCaption": "职务编号",
                "cCaptionResid": "P_YS_OA_LCGL_0000037109",
                "cShowCaption": "职务编号",
                "cShowCaptionResid": "P_YS_OA_LCGL_0000037109",
                "iMaxLength": 255,
                "iFieldType": 1,
                "bEnum": false,
                "bMustSelect": true,
                "bHidden": false,
                "bSplit": false,
                "bExtend": false,
                "bCanModify": true,
                "iMaxShowLen": 255,
                "iColWidth": 1,
                "iAlign": 1,
                "bShowIt": true,
                "bFilter": false,
                "iTabIndex": 0,
                "bIsNull": false,
                "bPrintCaption": true,
                "bJointQuery": false,
                "bPrintUpCase": false,
                "bSelfDefine": false,
                "cControlType": "Input",
                "iOrder": 1,
                "bMain": true,
                "cStyle": "{\"examples\":\"0001\",\"explains_ori\":\"请输入职务编码\",\"explains\":\"请输入职务编码\"}",
                "id": 34659651099,
                "bVmExclude": 0,
                "iBillTplGroupId": 147288617,
                "iBillId": 1008914277,
                "iBillEntityId": 15557589,
                "iTplId": 15374559,
                "cSubId": "staff",
                "iSystem": 1,
                "cName": "code",
                "cFieldName": "code",
                "authLevel": 3,
                "cDataSourceName": "bd.duty.Duty",
                "enterDirection": 4,
                "bEnableFormat": false
              },
              {
                "cItemName": "name",
                "cCaption": "职务名称",
                "cCaptionResid": "P_YS_OA_LCGL_0000037107",
                "cShowCaption": "职务名称",
                "cShowCaptionResid": "P_YS_OA_LCGL_0000037107",
                "iMaxLength": 255,
                "iFieldType": 1,
                "bEnum": false,
                "bMustSelect": true,
                "bHidden": false,
                "bSplit": false,
                "bExtend": false,
                "bCanModify": true,
                "iMaxShowLen": 255,
                "iColWidth": 1,
                "iAlign": 1,
                "bShowIt": true,
                "bFilter": false,
                "iTabIndex": 1,
                "bIsNull": false,
                "bPrintCaption": true,
                "bJointQuery": false,
                "bPrintUpCase": false,
                "bSelfDefine": false,
                "cControlType": "InputMultiLang",
                "iOrder": 2,
                "bMain": true,
                "cStyle": "{\"examples\":\"4A\",\"explains_ori\":\"请输入职务名称\",\"explains\":\"请输入职务名称\"}",
                "id": 34659651100,
                "bVmExclude": 0,
                "iBillTplGroupId": 147288617,
                "iBillId": 1008914277,
                "iBillEntityId": 15557589,
                "iTplId": 15374559,
                "cSubId": "staff",
                "iSystem": 1,
                "cName": "name",
                "cFieldName": "name",
                "authLevel": 3,
                "cDataSourceName": "bd.duty.Duty",
                "enterDirection": 4,
                "bEnableFormat": false
              },
              {
                "cItemName": "jobtype_id_name",
                "cCaption": "职务类别",
                "cCaptionResid": "P_YS_PF_GZTSYS_0000012645",
                "cShowCaption": "职务类别",
                "cShowCaptionResid": "P_YS_PF_GZTSYS_0000012645",
                "iMaxLength": 255,
                "iFieldType": 1,
                "bEnum": false,
                "bMustSelect": true,
                "bHidden": false,
                "bSplit": false,
                "bExtend": false,
                "bCanModify": true,
                "iMaxShowLen": 255,
                "iColWidth": 1,
                "iAlign": 1,
                "bShowIt": true,
                "bFilter": false,
                "iTabIndex": 3,
                "bIsNull": false,
                "bPrintCaption": true,
                "bJointQuery": false,
                "bPrintUpCase": false,
                "bSelfDefine": false,
                "cControlType": "refer",
                "cRefType": "bd_dutyType",
                "cRefRetId": "{\"jobtype_id\":\"id\"}",
                "iOrder": 4,
                "bMain": true,
                "cStyle": "{\"examples\":\"01\",\"explains_ori\":\"请输入职务类别编码\",\"explains\":\"请输入职务类别编码\"}",
                "id": 34659651102,
                "bVmExclude": 0,
                "iBillTplGroupId": 147288617,
                "iBillId": 1008914277,
                "iBillEntityId": 15557589,
                "iTplId": 15374559,
                "cSubId": "staff",
                "iSystem": 1,
                "cName": "jobtype_id_name",
                "cFieldName": "jobtype_id.name",
                "authLevel": 3,
                "cDataSourceName": "bd.duty.Duty",
                "enterDirection": 4,
                "bEnableFormat": false
              },
              {
                "cItemName": "jobgrade_id_name",
                "cCaption": "职级",
                "cCaptionResid": "P_YS_PF_GZTSYS_0000012795",
                "cShowCaption": "职级",
                "cShowCaptionResid": "P_YS_PF_GZTSYS_0000012795",
                "iMaxLength": 255,
                "iFieldType": 1,
                "bEnum": false,
                "bMustSelect": true,
                "bHidden": false,
                "bSplit": false,
                "bExtend": false,
                "bCanModify": true,
                "iMaxShowLen": 255,
                "iColWidth": 1,
                "iAlign": 1,
                "bShowIt": true,
                "bFilter": false,
                "iTabIndex": 5,
                "bIsNull": true,
                "bPrintCaption": true,
                "bJointQuery": false,
                "bPrintUpCase": false,
                "bSelfDefine": false,
                "cControlType": "refer",
                "cRefType": "bd_rankref",
                "cRefRetId": "{\"jobgrade_id\":\"id\",\"maxrank_id\":\"maxrank_id\",\"minrank_id\":\"minrank_id\",\"maxrank_id_name\":\"maxrank_id_name\",\"minrank_id_name\":\"minrank_id_name\"}",
                "iOrder": 6,
                "bMain": true,
                "cStyle": "{\"examples\":\"02\",\"explains_ori\":\"请输入职级编码\",\"explains\":\"请输入职级编码\"}",
                "id": 34659651104,
                "bVmExclude": 0,
                "iBillTplGroupId": 147288617,
                "iBillId": 1008914277,
                "iBillEntityId": 15557589,
                "iTplId": 15374559,
                "cSubId": "staff",
                "iSystem": 1,
                "cName": "jobgrade_id_name",
                "cFieldName": "jobgrade_id.name",
                "authLevel": 3,
                "cDataSourceName": "bd.duty.Duty",
                "enterDirection": 4,
                "bEnableFormat": false
              },
              {
                "cItemName": "maxrank_id_name",
                "cCaption": "最高职等",
                "cCaptionResid": "P_YS_HR_HRCOREF_0000058358",
                "cShowCaption": "最高职等",
                "cShowCaptionResid": "P_YS_HR_HRCOREF_0000058358",
                "iMaxLength": 255,
                "iFieldType": 1,
                "bEnum": false,
                "bMustSelect": true,
                "bHidden": false,
                "bSplit": false,
                "bExtend": false,
                "bCanModify": true,
                "iMaxShowLen": 255,
                "iColWidth": 1,
                "iAlign": 1,
                "bShowIt": true,
                "bFilter": false,
                "iTabIndex": 7,
                "bIsNull": true,
                "bPrintCaption": true,
                "bJointQuery": false,
                "bPrintUpCase": false,
                "bSelfDefine": false,
                "cControlType": "refer",
                "cRefType": "bd_graderef",
                "cRefRetId": "{\"maxrank_id\":\"id\"}",
                "iOrder": 8,
                "bMain": true,
                "cStyle": "{\"examples\":\"5B\",\"explains_ori\":\"请输入职等编码,最高职等不能低于最低职等\",\"explains\":\"请输入职等编码,最高职等不能低于最低职等\"}",
                "id": 34659651106,
                "bVmExclude": 0,
                "iBillTplGroupId": 147288617,
                "iBillId": 1008914277,
                "iBillEntityId": 15557589,
                "iTplId": 15374559,
                "cSubId": "staff",
                "iSystem": 1,
                "cName": "maxrank_id_name",
                "cFieldName": "maxrank_id.name",
                "authLevel": 3,
                "cDataSourceName": "bd.duty.Duty",
                "enterDirection": 4,
                "bEnableFormat": false
              },
              {
                "cItemName": "minrank_id_name",
                "cCaption": "最低职等",
                "cCaptionResid": "P_YS_HR_HRCOREF_0000058177",
                "cShowCaption": "最低职等",
                "cShowCaptionResid": "P_YS_HR_HRCOREF_0000058177",
                "iMaxLength": 255,
                "iFieldType": 1,
                "bEnum": false,
                "bMustSelect": true,
                "bHidden": false,
                "bSplit": false,
                "bExtend": false,
                "bCanModify": true,
                "iMaxShowLen": 255,
                "iColWidth": 1,
                "iAlign": 1,
                "bShowIt": true,
                "bFilter": false,
                "iTabIndex": 9,
                "bIsNull": true,
                "bPrintCaption": true,
                "bJointQuery": false,
                "bPrintUpCase": false,
                "bSelfDefine": false,
                "cControlType": "refer",
                "cRefType": "bd_graderef",
                "cRefRetId": "{\"minrank_id\":\"id\"}",
                "iOrder": 10,
                "bMain": true,
                "cStyle": "{\"examples\":\"4A\",\"explains_ori\":\"请输入职等编码,最高职等不能低于最低职等\",\"explains\":\"请输入职等编码,最高职等不能低于最低职等\"}",
                "id": 34659651108,
                "bVmExclude": 0,
                "iBillTplGroupId": 147288617,
                "iBillId": 1008914277,
                "iBillEntityId": 15557589,
                "iTplId": 15374559,
                "cSubId": "staff",
                "iSystem": 1,
                "cName": "minrank_id_name",
                "cFieldName": "minrank_id.name",
                "authLevel": 3,
                "cDataSourceName": "bd.duty.Duty",
                "enterDirection": 4,
                "bEnableFormat": false
              },
              {
                "cItemName": "duties",
                "cCaption": "职责",
                "cCaptionResid": "P_YS_PF_GZTTMP_0000073989",
                "cShowCaption": "职责",
                "cShowCaptionResid": "P_YS_PF_GZTTMP_0000073989",
                "iMaxLength": 255,
                "iFieldType": 1,
                "bEnum": false,
                "bMustSelect": true,
                "bHidden": false,
                "bSplit": false,
                "bExtend": false,
                "bCanModify": true,
                "iMaxShowLen": 255,
                "iColWidth": 1,
                "iAlign": 1,
                "bShowIt": true,
                "bFilter": false,
                "iTabIndex": 10,
                "bIsNull": true,
                "bPrintCaption": true,
                "bJointQuery": false,
                "bPrintUpCase": false,
                "bSelfDefine": false,
                "cControlType": "Input",
                "iOrder": 11,
                "bMain": true,
                "cStyle": "{\"examples\":\"XXX\",\"explains_ori\":\"职责描述\",\"explains\":\"职责描述\"}",
                "id": 34659651109,
                "bVmExclude": 0,
                "iBillTplGroupId": 147288617,
                "iBillId": 1008914277,
                "iBillEntityId": 15557589,
                "iTplId": 15374559,
                "cSubId": "staff",
                "iSystem": 1,
                "cName": "duties",
                "cFieldName": "duties",
                "authLevel": 3,
                "cDataSourceName": "bd.duty.Duty",
                "enterDirection": 4,
                "bEnableFormat": false
              },
              {
                "cItemName": "memo",
                "cCaption": "备注",
                "cCaptionResid": "P_YS_FI_CM_0000029174",
                "cShowCaption": "备注",
                "cShowCaptionResid": "P_YS_FI_CM_0000029174",
                "iMaxLength": 255,
                "iFieldType": 1,
                "bEnum": false,
                "bMustSelect": true,
                "bHidden": false,
                "bSplit": false,
                "bExtend": false,
                "bCanModify": true,
                "iMaxShowLen": 255,
                "iColWidth": 1,
                "iAlign": 1,
                "bShowIt": true,
                "bFilter": false,
                "iTabIndex": 11,
                "bIsNull": true,
                "bPrintCaption": true,
                "bJointQuery": false,
                "bPrintUpCase": false,
                "bSelfDefine": false,
                "cControlType": "InputMultiLang",
                "iOrder": 12,
                "bMain": true,
                "cStyle": "{\"examples\":\"XXX\",\"explains_ori\":\"备注\",\"explains\":\"备注\"}",
                "id": 34659651110,
                "bVmExclude": 0,
                "iBillTplGroupId": 147288617,
                "iBillId": 1008914277,
                "iBillEntityId": 15557589,
                "iTplId": 15374559,
                "cSubId": "staff",
                "iSystem": 1,
                "cName": "memo",
                "cFieldName": "memo",
                "authLevel": 3,
                "cDataSourceName": "bd.duty.Duty",
                "enterDirection": 4,
                "bEnableFormat": false
              }
            ]
          },
          {
            "groupId": 147288618,
            "cName": "footertoolbar",
            "iOrder": 12,
            "bMain": true,
            "cCode": "duty",
            "cDataSourceName": "bd.duty.Duty",
            "cControlType": "div",
            "cGroupCode": "footertoolbar",
            "cAlign": "bottom",
            "iCols": 0,
            "cStyle": "{\"classname\":\"ant-row-flex-end\"}"
          }
        ],
        "templateType": "modal"
      },
      "extscripturls": [],
      "isCoded": false,
      "vmName": "staff_duty_VM",
      "extendFileName": "staff_duty_VM.Extend.js",
      "extendVmName": "staff_duty_VM_Extend"
    },
    "vm": "\n      //archive\n      \n    console.info('%c staff_duty_VM js init', 'color:green');\n    cb.viewmodels.register('staff_duty_VM', function (modelType) {\n\n      var model = function (data) {\n        cb.models.ContainerModel.call(this,data);\n        this.init();\n      };\n      model.prototype = cb.utils.getPrototype(cb.models.ContainerModel.prototype);\n      model.prototype.modelType = modelType;\n\n      model.prototype.init = function () {\n          var _this = this;\n          var fields = {\n            \n              \n              'code':new cb.models.SimpleModel({\"cFieldName\":\"code\",\"cItemName\":\"code\",\"cCaption\":\"职务编号\",\"cCaptionResid\":\"P_YS_OA_LCGL_0000037109\",\"cShowCaption\":\"职务编号\",\"cShowCaptionResid\":\"P_YS_OA_LCGL_0000037109\",\"iBillEntityId\":15557589,\"iBillTplGroupId\":147288617,\"iTplId\":15374559,\"iMaxLength\":255,\"iFieldType\":1,\"bEnum\":false,\"bMustSelect\":true,\"bHidden\":false,\"bSplit\":false,\"bExtend\":false,\"bCanModify\":true,\"iMaxShowLen\":255,\"iColWidth\":1,\"bShowIt\":true,\"bFilter\":false,\"bIsNull\":false,\"bPrintCaption\":true,\"bJointQuery\":false,\"bPrintUpCase\":false,\"bSelfDefine\":false,\"cOrder\":\"asc\",\"cTplGroupName\":\"duty\",\"bMain\":true,\"cDataSourceName\":\"bd.duty.Duty\",\"cControlType\":\"Input\",\"cStyle\":\"{\\\"examples\\\":\\\"0001\\\",\\\"explains_ori\\\":\\\"请输入职务编码\\\",\\\"explains\\\":\\\"请输入职务编码\\\"}\",\"bVmExclude\":0,\"iOrder\":1,\"isshoprelated\":false,\"iSystem\":1,\"authLevel\":3,\"isExport\":true,\"uncopyable\":false,\"iAlign\":1,\"bEnableFormat\":false,\"domainKey\":\"staffcenter\"}),\n            \n              \n              'name':new cb.models.SimpleModel({\"cFieldName\":\"name\",\"cItemName\":\"name\",\"cCaption\":\"职务名称\",\"cCaptionResid\":\"P_YS_OA_LCGL_0000037107\",\"cShowCaption\":\"职务名称\",\"cShowCaptionResid\":\"P_YS_OA_LCGL_0000037107\",\"iBillEntityId\":15557589,\"iBillTplGroupId\":147288617,\"iTplId\":15374559,\"iMaxLength\":255,\"iFieldType\":1,\"bEnum\":false,\"bMustSelect\":true,\"bHidden\":false,\"bSplit\":false,\"bExtend\":false,\"bCanModify\":true,\"iMaxShowLen\":255,\"iColWidth\":1,\"bShowIt\":true,\"bFilter\":false,\"bIsNull\":false,\"bPrintCaption\":true,\"bJointQuery\":false,\"bPrintUpCase\":false,\"bSelfDefine\":false,\"cTplGroupName\":\"duty\",\"bMain\":true,\"cDataSourceName\":\"bd.duty.Duty\",\"cControlType\":\"InputMultiLang\",\"cStyle\":\"{\\\"examples\\\":\\\"4A\\\",\\\"explains_ori\\\":\\\"请输入职务名称\\\",\\\"explains\\\":\\\"请输入职务名称\\\"}\",\"bVmExclude\":0,\"iOrder\":2,\"isshoprelated\":false,\"iSystem\":1,\"authLevel\":3,\"isExport\":true,\"uncopyable\":false,\"iAlign\":1,\"bEnableFormat\":false,\"domainKey\":\"staffcenter\"}),\n            \n              \n              'jobtype_id':new cb.models.SimpleModel({\"cFieldName\":\"jobtype_id\",\"cItemName\":\"jobtype_id\",\"cCaption\":\"职务类别\",\"cCaptionResid\":\"P_YS_PF_GZTSYS_0000012645\",\"cShowCaption\":\"职务类别\",\"cShowCaptionResid\":\"P_YS_PF_GZTSYS_0000012645\",\"iBillEntityId\":15557589,\"iBillTplGroupId\":147288617,\"iTplId\":15374559,\"iMaxLength\":255,\"iFieldType\":1,\"bEnum\":false,\"bMustSelect\":true,\"bHidden\":true,\"bSplit\":false,\"bExtend\":false,\"bCanModify\":true,\"iMaxShowLen\":255,\"iColWidth\":1,\"bShowIt\":true,\"bFilter\":false,\"bIsNull\":true,\"bPrintCaption\":true,\"bJointQuery\":false,\"bPrintUpCase\":false,\"bSelfDefine\":false,\"cTplGroupName\":\"duty\",\"bMain\":true,\"cDataSourceName\":\"bd.duty.Duty\",\"cControlType\":\"Input\",\"bVmExclude\":0,\"iOrder\":3,\"isshoprelated\":false,\"iSystem\":1,\"authLevel\":3,\"isExport\":false,\"uncopyable\":false,\"iAlign\":1,\"bEnableFormat\":false,\"domainKey\":\"staffcenter\"}),\n            \n              \n              'jobtype_id_name':new cb.models.ReferModel({\"cFieldName\":\"jobtype_id.name\",\"cItemName\":\"jobtype_id_name\",\"cCaption\":\"职务类别\",\"cCaptionResid\":\"P_YS_PF_GZTSYS_0000012645\",\"cShowCaption\":\"职务类别\",\"cShowCaptionResid\":\"P_YS_PF_GZTSYS_0000012645\",\"iBillEntityId\":15557589,\"iBillTplGroupId\":147288617,\"iTplId\":15374559,\"iMaxLength\":255,\"iFieldType\":1,\"bEnum\":false,\"bMustSelect\":true,\"bHidden\":false,\"cRefType\":\"bd_dutyType\",\"cRefRetId\":\"{\\\"jobtype_id\\\":\\\"id\\\"}\",\"bSplit\":false,\"bExtend\":false,\"bCanModify\":true,\"iMaxShowLen\":255,\"iColWidth\":1,\"bShowIt\":true,\"bFilter\":false,\"bIsNull\":false,\"bPrintCaption\":true,\"bJointQuery\":false,\"bPrintUpCase\":false,\"bSelfDefine\":false,\"cTplGroupName\":\"duty\",\"bMain\":true,\"cDataSourceName\":\"bd.duty.Duty\",\"cControlType\":\"refer\",\"refReturn\":\"name\",\"cStyle\":\"{\\\"examples\\\":\\\"01\\\",\\\"explains_ori\\\":\\\"请输入职务类别编码\\\",\\\"explains\\\":\\\"请输入职务类别编码\\\"}\",\"bVmExclude\":0,\"iOrder\":4,\"isshoprelated\":false,\"iSystem\":1,\"authLevel\":3,\"isExport\":true,\"uncopyable\":false,\"iAlign\":1,\"bEnableFormat\":false,\"domainKey\":\"staffcenter\"}),\n            \n              \n              'jobgrade_id':new cb.models.SimpleModel({\"cFieldName\":\"jobgrade_id\",\"cItemName\":\"jobgrade_id\",\"cCaption\":\"职级\",\"cCaptionResid\":\"P_YS_PF_GZTSYS_0000012795\",\"cShowCaption\":\"职级\",\"cShowCaptionResid\":\"P_YS_PF_GZTSYS_0000012795\",\"iBillEntityId\":15557589,\"iBillTplGroupId\":147288617,\"iTplId\":15374559,\"iMaxLength\":255,\"iFieldType\":1,\"bEnum\":false,\"bMustSelect\":true,\"bHidden\":true,\"bSplit\":false,\"bExtend\":false,\"bCanModify\":true,\"iMaxShowLen\":255,\"iColWidth\":1,\"bShowIt\":true,\"bFilter\":false,\"bIsNull\":true,\"bPrintCaption\":true,\"bJointQuery\":false,\"bPrintUpCase\":false,\"bSelfDefine\":false,\"cTplGroupName\":\"duty\",\"bMain\":true,\"cDataSourceName\":\"bd.duty.Duty\",\"cControlType\":\"Input\",\"bVmExclude\":0,\"iOrder\":5,\"isshoprelated\":false,\"iSystem\":1,\"authLevel\":3,\"isExport\":false,\"uncopyable\":false,\"iAlign\":1,\"bEnableFormat\":false,\"domainKey\":\"staffcenter\"}),\n            \n              \n              'jobgrade_id_name':new cb.models.ReferModel({\"cFieldName\":\"jobgrade_id.name\",\"cItemName\":\"jobgrade_id_name\",\"cCaption\":\"职级\",\"cCaptionResid\":\"P_YS_PF_GZTSYS_0000012795\",\"cShowCaption\":\"职级\",\"cShowCaptionResid\":\"P_YS_PF_GZTSYS_0000012795\",\"iBillEntityId\":15557589,\"iBillTplGroupId\":147288617,\"iTplId\":15374559,\"iMaxLength\":255,\"iFieldType\":1,\"bEnum\":false,\"bMustSelect\":true,\"bHidden\":false,\"cRefType\":\"bd_rankref\",\"cRefRetId\":\"{\\\"jobgrade_id\\\":\\\"id\\\",\\\"maxrank_id\\\":\\\"maxrank_id\\\",\\\"minrank_id\\\":\\\"minrank_id\\\",\\\"maxrank_id_name\\\":\\\"maxrank_id_name\\\",\\\"minrank_id_name\\\":\\\"minrank_id_name\\\"}\",\"bSplit\":false,\"bExtend\":false,\"bCanModify\":true,\"iMaxShowLen\":255,\"iColWidth\":1,\"bShowIt\":true,\"bFilter\":false,\"bIsNull\":true,\"bPrintCaption\":true,\"bJointQuery\":false,\"bPrintUpCase\":false,\"bSelfDefine\":false,\"cTplGroupName\":\"duty\",\"bMain\":true,\"cDataSourceName\":\"bd.duty.Duty\",\"cControlType\":\"refer\",\"refReturn\":\"name\",\"cStyle\":\"{\\\"examples\\\":\\\"02\\\",\\\"explains_ori\\\":\\\"请输入职级编码\\\",\\\"explains\\\":\\\"请输入职级编码\\\"}\",\"bVmExclude\":0,\"iOrder\":6,\"isshoprelated\":false,\"iSystem\":1,\"authLevel\":3,\"isExport\":true,\"uncopyable\":false,\"iAlign\":1,\"bEnableFormat\":false,\"domainKey\":\"staffcenter\"}),\n            \n              \n              'maxrank_id':new cb.models.SimpleModel({\"cFieldName\":\"maxrank_id\",\"cItemName\":\"maxrank_id\",\"cCaption\":\"最高职等\",\"cCaptionResid\":\"P_YS_HR_HRCOREF_0000058358\",\"cShowCaption\":\"最高职等\",\"cShowCaptionResid\":\"P_YS_HR_HRCOREF_0000058358\",\"iBillEntityId\":15557589,\"iBillTplGroupId\":147288617,\"iTplId\":15374559,\"iMaxLength\":255,\"iFieldType\":1,\"bEnum\":false,\"bMustSelect\":true,\"bHidden\":true,\"bSplit\":false,\"bExtend\":false,\"bCanModify\":true,\"iMaxShowLen\":255,\"iColWidth\":1,\"bShowIt\":true,\"bFilter\":false,\"bIsNull\":true,\"bPrintCaption\":true,\"bJointQuery\":false,\"bPrintUpCase\":false,\"bSelfDefine\":false,\"cTplGroupName\":\"duty\",\"bMain\":true,\"cDataSourceName\":\"bd.duty.Duty\",\"cControlType\":\"Input\",\"bVmExclude\":0,\"iOrder\":7,\"isshoprelated\":false,\"iSystem\":1,\"authLevel\":3,\"isExport\":false,\"uncopyable\":false,\"iAlign\":1,\"bEnableFormat\":false,\"domainKey\":\"staffcenter\"}),\n            \n              \n              'maxrank_id_name':new cb.models.ReferModel({\"cFieldName\":\"maxrank_id.name\",\"cItemName\":\"maxrank_id_name\",\"cCaption\":\"最高职等\",\"cCaptionResid\":\"P_YS_HR_HRCOREF_0000058358\",\"cShowCaption\":\"最高职等\",\"cShowCaptionResid\":\"P_YS_HR_HRCOREF_0000058358\",\"iBillEntityId\":15557589,\"iBillTplGroupId\":147288617,\"iTplId\":15374559,\"iMaxLength\":255,\"iFieldType\":1,\"bEnum\":false,\"bMustSelect\":true,\"bHidden\":false,\"cRefType\":\"bd_graderef\",\"cRefRetId\":\"{\\\"maxrank_id\\\":\\\"id\\\"}\",\"bSplit\":false,\"bExtend\":false,\"bCanModify\":true,\"iMaxShowLen\":255,\"iColWidth\":1,\"bShowIt\":true,\"bFilter\":false,\"bIsNull\":true,\"bPrintCaption\":true,\"bJointQuery\":false,\"bPrintUpCase\":false,\"bSelfDefine\":false,\"cTplGroupName\":\"duty\",\"bMain\":true,\"cDataSourceName\":\"bd.duty.Duty\",\"cControlType\":\"refer\",\"refReturn\":\"name\",\"cStyle\":\"{\\\"examples\\\":\\\"5B\\\",\\\"explains_ori\\\":\\\"请输入职等编码,最高职等不能低于最低职等\\\",\\\"explains\\\":\\\"请输入职等编码,最高职等不能低于最低职等\\\"}\",\"bVmExclude\":0,\"iOrder\":8,\"isshoprelated\":false,\"iSystem\":1,\"authLevel\":3,\"isExport\":true,\"uncopyable\":false,\"iAlign\":1,\"bEnableFormat\":false,\"domainKey\":\"staffcenter\"}),\n            \n              \n              'minrank_id':new cb.models.SimpleModel({\"cFieldName\":\"minrank_id\",\"cItemName\":\"minrank_id\",\"cCaption\":\"最低职等\",\"cCaptionResid\":\"P_YS_HR_HRCOREF_0000058177\",\"cShowCaption\":\"最低职等\",\"cShowCaptionResid\":\"P_YS_HR_HRCOREF_0000058177\",\"iBillEntityId\":15557589,\"iBillTplGroupId\":147288617,\"iTplId\":15374559,\"iMaxLength\":255,\"iFieldType\":1,\"bEnum\":false,\"bMustSelect\":true,\"bHidden\":true,\"bSplit\":false,\"bExtend\":false,\"bCanModify\":true,\"iMaxShowLen\":255,\"iColWidth\":1,\"bShowIt\":true,\"bFilter\":false,\"bIsNull\":true,\"bPrintCaption\":true,\"bJointQuery\":false,\"bPrintUpCase\":false,\"bSelfDefine\":false,\"cTplGroupName\":\"duty\",\"bMain\":true,\"cDataSourceName\":\"bd.duty.Duty\",\"cControlType\":\"Input\",\"bVmExclude\":0,\"iOrder\":9,\"isshoprelated\":false,\"iSystem\":1,\"authLevel\":3,\"isExport\":false,\"uncopyable\":false,\"iAlign\":1,\"bEnableFormat\":false,\"domainKey\":\"staffcenter\"}),\n            \n              \n              'minrank_id_name':new cb.models.ReferModel({\"cFieldName\":\"minrank_id.name\",\"cItemName\":\"minrank_id_name\",\"cCaption\":\"最低职等\",\"cCaptionResid\":\"P_YS_HR_HRCOREF_0000058177\",\"cShowCaption\":\"最低职等\",\"cShowCaptionResid\":\"P_YS_HR_HRCOREF_0000058177\",\"iBillEntityId\":15557589,\"iBillTplGroupId\":147288617,\"iTplId\":15374559,\"iMaxLength\":255,\"iFieldType\":1,\"bEnum\":false,\"bMustSelect\":true,\"bHidden\":false,\"cRefType\":\"bd_graderef\",\"cRefRetId\":\"{\\\"minrank_id\\\":\\\"id\\\"}\",\"bSplit\":false,\"bExtend\":false,\"bCanModify\":true,\"iMaxShowLen\":255,\"iColWidth\":1,\"bShowIt\":true,\"bFilter\":false,\"bIsNull\":true,\"bPrintCaption\":true,\"bJointQuery\":false,\"bPrintUpCase\":false,\"bSelfDefine\":false,\"cTplGroupName\":\"duty\",\"bMain\":true,\"cDataSourceName\":\"bd.duty.Duty\",\"cControlType\":\"refer\",\"refReturn\":\"name\",\"cStyle\":\"{\\\"examples\\\":\\\"4A\\\",\\\"explains_ori\\\":\\\"请输入职等编码,最高职等不能低于最低职等\\\",\\\"explains\\\":\\\"请输入职等编码,最高职等不能低于最低职等\\\"}\",\"bVmExclude\":0,\"iOrder\":10,\"isshoprelated\":false,\"iSystem\":1,\"authLevel\":3,\"isExport\":true,\"uncopyable\":false,\"iAlign\":1,\"bEnableFormat\":false,\"domainKey\":\"staffcenter\"}),\n            \n              \n              'duties':new cb.models.SimpleModel({\"cFieldName\":\"duties\",\"cItemName\":\"duties\",\"cCaption\":\"职责\",\"cCaptionResid\":\"P_YS_PF_GZTTMP_0000073989\",\"cShowCaption\":\"职责\",\"cShowCaptionResid\":\"P_YS_PF_GZTTMP_0000073989\",\"iBillEntityId\":15557589,\"iBillTplGroupId\":147288617,\"iTplId\":15374559,\"iMaxLength\":255,\"iFieldType\":1,\"bEnum\":false,\"bMustSelect\":true,\"bHidden\":false,\"bSplit\":false,\"bExtend\":false,\"bCanModify\":true,\"iMaxShowLen\":255,\"iColWidth\":1,\"bShowIt\":true,\"bFilter\":false,\"bIsNull\":true,\"bPrintCaption\":true,\"bJointQuery\":false,\"bPrintUpCase\":false,\"bSelfDefine\":false,\"cTplGroupName\":\"duty\",\"bMain\":true,\"cDataSourceName\":\"bd.duty.Duty\",\"cControlType\":\"Input\",\"cStyle\":\"{\\\"examples\\\":\\\"XXX\\\",\\\"explains_ori\\\":\\\"职责描述\\\",\\\"explains\\\":\\\"职责描述\\\"}\",\"bVmExclude\":0,\"iOrder\":11,\"isshoprelated\":false,\"iSystem\":1,\"authLevel\":3,\"isExport\":true,\"uncopyable\":false,\"iAlign\":1,\"bEnableFormat\":false,\"domainKey\":\"staffcenter\"}),\n            \n              \n              'memo':new cb.models.SimpleModel({\"cFieldName\":\"memo\",\"cItemName\":\"memo\",\"cCaption\":\"备注\",\"cCaptionResid\":\"P_YS_FI_CM_0000029174\",\"cShowCaption\":\"备注\",\"cShowCaptionResid\":\"P_YS_FI_CM_0000029174\",\"iBillEntityId\":15557589,\"iBillTplGroupId\":147288617,\"iTplId\":15374559,\"iMaxLength\":255,\"iFieldType\":1,\"bEnum\":false,\"bMustSelect\":true,\"bHidden\":false,\"bSplit\":false,\"bExtend\":false,\"bCanModify\":true,\"iMaxShowLen\":255,\"iColWidth\":1,\"bShowIt\":true,\"bFilter\":false,\"bIsNull\":true,\"bPrintCaption\":true,\"bJointQuery\":false,\"bPrintUpCase\":false,\"bSelfDefine\":false,\"cTplGroupName\":\"duty\",\"bMain\":true,\"cDataSourceName\":\"bd.duty.Duty\",\"cControlType\":\"InputMultiLang\",\"cStyle\":\"{\\\"examples\\\":\\\"XXX\\\",\\\"explains_ori\\\":\\\"备注\\\",\\\"explains\\\":\\\"备注\\\"}\",\"bVmExclude\":0,\"iOrder\":12,\"isshoprelated\":false,\"iSystem\":1,\"authLevel\":3,\"isExport\":true,\"uncopyable\":false,\"iAlign\":1,\"bEnableFormat\":false,\"domainKey\":\"staffcenter\"}),\n            \n              \n              'enable':new cb.models.ListModel({\"cFieldName\":\"enable\",\"cItemName\":\"enable\",\"cCaption\":\"状态\",\"cCaptionResid\":\"P_YS_FED_EXAMP_0000020328\",\"cShowCaption\":\"状态\",\"cShowCaptionResid\":\"P_YS_FED_EXAMP_0000020328\",\"iBillEntityId\":15557589,\"iBillTplGroupId\":147288617,\"iTplId\":15374559,\"iMaxLength\":255,\"iFieldType\":1,\"bEnum\":true,\"cEnumString\":\"{\\n  \\\"0\\\": \\\"未启用\\\",\\n  \\\"1\\\": \\\"启用\\\",\\n  \\\"2\\\": \\\"停用\\\"\\n}\",\"enumArray\":\"[\\n  {\\n    \\\"nameType\\\": \\\"text\\\",\\n    \\\"icon\\\": null,\\n    \\\"value\\\": \\\"未启用\\\",\\n    \\\"resid\\\": \\\"P_YS_FED_FW_0000021817\\\",\\n    \\\"key\\\": \\\"0\\\"\\n  },\\n  {\\n    \\\"nameType\\\": \\\"text\\\",\\n    \\\"icon\\\": null,\\n    \\\"value\\\": \\\"启用\\\",\\n    \\\"resid\\\": \\\"P_YS_FED_FW_0000021014\\\",\\n    \\\"key\\\": \\\"1\\\"\\n  },\\n  {\\n    \\\"nameType\\\": \\\"text\\\",\\n    \\\"icon\\\": null,\\n    \\\"value\\\": \\\"停用\\\",\\n    \\\"resid\\\": \\\"P_YS_FED_FW_0000020955\\\",\\n    \\\"key\\\": \\\"2\\\"\\n  }\\n]\",\"cEnumType\":\"bd_enable_type\",\"bMustSelect\":true,\"bHidden\":true,\"bSplit\":false,\"bExtend\":false,\"bCanModify\":true,\"iMaxShowLen\":255,\"iColWidth\":1,\"bShowIt\":true,\"bFilter\":false,\"cDefaultValue\":\"1\",\"bIsNull\":false,\"bPrintCaption\":true,\"bJointQuery\":false,\"bPrintUpCase\":false,\"bSelfDefine\":false,\"cTplGroupName\":\"duty\",\"bMain\":true,\"cDataSourceName\":\"bd.duty.Duty\",\"cControlType\":\"select\",\"bVmExclude\":0,\"iOrder\":13,\"isshoprelated\":false,\"iSystem\":1,\"authLevel\":3,\"isExport\":false,\"uncopyable\":false,\"iAlign\":1,\"bEnableFormat\":false,\"domainKey\":\"staffcenter\"}),\n            \n              \n              'id':new cb.models.SimpleModel({\"cFieldName\":\"id\",\"cItemName\":\"id\",\"cCaption\":\"id\",\"cShowCaption\":\"id\",\"iBillEntityId\":15557589,\"iBillTplGroupId\":147288617,\"iTplId\":15374559,\"iMaxLength\":255,\"iFieldType\":1,\"bEnum\":false,\"bMustSelect\":true,\"bHidden\":true,\"bSplit\":false,\"bExtend\":false,\"bCanModify\":true,\"iMaxShowLen\":255,\"iColWidth\":1,\"bShowIt\":true,\"bFilter\":false,\"bIsNull\":true,\"bPrintCaption\":true,\"bJointQuery\":false,\"bPrintUpCase\":false,\"bSelfDefine\":false,\"cTplGroupName\":\"duty\",\"bMain\":true,\"cDataSourceName\":\"bd.duty.Duty\",\"cControlType\":\"Input\",\"bVmExclude\":0,\"iOrder\":14,\"isshoprelated\":false,\"iSystem\":1,\"authLevel\":3,\"isExport\":false,\"uncopyable\":false,\"iAlign\":1,\"bEnableFormat\":false,\"domainKey\":\"staffcenter\"}),\n            \n              \n              'pubts':new cb.models.SimpleModel({\"cFieldName\":\"pubts\",\"cItemName\":\"pubts\",\"cCaption\":\"时间戳\",\"cCaptionResid\":\"P_YS_PF_GZTORG_0000035390\",\"cShowCaption\":\"时间戳\",\"cShowCaptionResid\":\"P_YS_PF_GZTORG_0000035390\",\"iBillEntityId\":15557589,\"iBillTplGroupId\":147288617,\"iTplId\":15374559,\"iMaxLength\":255,\"iFieldType\":1,\"bEnum\":false,\"bMustSelect\":true,\"bHidden\":true,\"bSplit\":false,\"bExtend\":false,\"bCanModify\":true,\"iMaxShowLen\":255,\"iColWidth\":1,\"bShowIt\":true,\"bFilter\":false,\"bIsNull\":true,\"bPrintCaption\":true,\"bJointQuery\":false,\"bPrintUpCase\":false,\"bSelfDefine\":false,\"cTplGroupName\":\"duty\",\"bMain\":true,\"cDataSourceName\":\"bd.duty.Duty\",\"cControlType\":\"Input\",\"bVmExclude\":0,\"iOrder\":15,\"isshoprelated\":false,\"iSystem\":1,\"authLevel\":3,\"isExport\":false,\"uncopyable\":false,\"iAlign\":1,\"bEnableFormat\":false,\"domainKey\":\"staffcenter\"}),\n            \n              \n              'sysid':new cb.models.SimpleModel({\"cFieldName\":\"sysid\",\"cItemName\":\"sysid\",\"cCaption\":\"应用主键\",\"cCaptionResid\":\"P_YS_PF_BD-UI_0000157811\",\"cShowCaption\":\"应用主键\",\"cShowCaptionResid\":\"P_YS_PF_BD-UI_0000157811\",\"iBillEntityId\":15557589,\"iBillTplGroupId\":147288617,\"iTplId\":15374559,\"iMaxLength\":255,\"iFieldType\":1,\"bEnum\":false,\"bMustSelect\":true,\"bHidden\":true,\"bSplit\":false,\"bExtend\":false,\"bCanModify\":true,\"iMaxShowLen\":255,\"iColWidth\":1,\"bShowIt\":true,\"bFilter\":false,\"cDefaultValue\":\"diwork\",\"bIsNull\":true,\"bPrintCaption\":true,\"bJointQuery\":false,\"bPrintUpCase\":false,\"bSelfDefine\":false,\"cTplGroupName\":\"duty\",\"bMain\":true,\"cDataSourceName\":\"bd.duty.Duty\",\"cControlType\":\"Input\",\"bVmExclude\":0,\"iOrder\":16,\"isshoprelated\":false,\"iSystem\":1,\"authLevel\":3,\"isExport\":false,\"uncopyable\":false,\"iAlign\":1,\"bEnableFormat\":false,\"domainKey\":\"staffcenter\"}),\n            \n              \n              'btnAbandon':new cb.models.SimpleModel({\"cItemName\":\"btnAbandon\",\"cCaption\":\"取消\",\"cCaptionResid\":\"P_YS_FED_EXAMP_0000020385\",\"cShowCaption\":\"取消\",\"cShowCaptionResid\":\"P_YS_FED_EXAMP_0000020385\",\"bEnum\":false,\"cControlType\":\"button\",\"iStyle\":1,\"cCommand\":\"cmdAbandon\",\"bVmExclude\":0,\"iOrder\":0,\"uncopyable\":false,\"bEnableFormat\":false,\"key\":\"34659315953\",\"domainKey\":\"staffcenter\",\"needClear\":false}),\n            \n              \n              'btnSaveAndAdd':new cb.models.SimpleModel({\"cItemName\":\"btnSaveAndAdd\",\"cCaption\":\"保存并新增\",\"cCaptionResid\":\"P_YS_FED_UCFBASEDOC_0000024712\",\"cShowCaption\":\"保存并新增\",\"cShowCaptionResid\":\"P_YS_FED_UCFBASEDOC_0000024712\",\"bEnum\":false,\"cControlType\":\"primarybutton\",\"iStyle\":1,\"cCommand\":\"cmdSaveAndAdd\",\"bVmExclude\":0,\"iOrder\":0,\"uncopyable\":false,\"bEnableFormat\":false,\"key\":\"34659315952\",\"domainKey\":\"staffcenter\",\"needClear\":false}),\n            \n              \n              'btnSave':new cb.models.SimpleModel({\"cItemName\":\"btnSave\",\"cCaption\":\"保存\",\"cCaptionResid\":\"P_YS_PF_GZTSYS_0000013477\",\"cShowCaption\":\"保存\",\"cShowCaptionResid\":\"P_YS_PF_GZTSYS_0000013477\",\"bEnum\":false,\"cControlType\":\"primarybutton\",\"iStyle\":1,\"cCommand\":\"cmdSave\",\"bVmExclude\":0,\"iOrder\":0,\"uncopyable\":false,\"bEnableFormat\":false,\"key\":\"34659315951\",\"domainKey\":\"staffcenter\",\"needClear\":false}),\n            \n              \n              'states':[{\"code\":\"browse\",\"items\":[{\"bVisible\":false,\"bEnable\":false,\"cName\":\"btnAbandon\",\"cGroup\":\"toolbaritem\"},{\"bVisible\":true,\"bEnable\":true,\"cName\":\"btnSaveAndAdd\",\"cGroup\":\"toolbaritem\"},{\"bVisible\":false,\"bEnable\":false,\"cName\":\"btnSave\",\"cGroup\":\"toolbaritem\"}]},{\"code\":\"unstop\",\"condition\":\"data.enable == 1 && mode == 'browse'\",\"items\":[{\"bVisible\":true,\"bEnable\":true,\"cName\":\"btnSaveAndAdd\",\"cGroup\":\"toolbaritem\"},{\"bVisible\":false,\"bEnable\":false,\"cName\":\"btnAbandon\",\"cGroup\":\"toolbaritem\"},{\"bVisible\":false,\"bEnable\":false,\"cName\":\"btnSave\",\"cGroup\":\"toolbaritem\"}]},{\"code\":\"edit\",\"items\":[{\"bVisible\":false,\"bEnable\":false,\"cName\":\"btnSaveAndAdd\",\"cGroup\":\"toolbaritem\"},{\"bVisible\":true,\"bEnable\":true,\"cName\":\"btnSave\",\"cGroup\":\"toolbaritem\"},{\"bVisible\":true,\"bEnable\":true,\"cName\":\"btnAbandon\",\"cGroup\":\"toolbaritem\"}]},{\"code\":\"stop\",\"condition\":\"(data.enable == 0 || data.enable == 2) && mode == 'browse'\",\"items\":[{\"bVisible\":false,\"bEnable\":false,\"cName\":\"btnSave\",\"cGroup\":\"toolbaritem\"},{\"bVisible\":false,\"bEnable\":false,\"cName\":\"btnAbandon\",\"cGroup\":\"toolbaritem\"},{\"bVisible\":true,\"bEnable\":true,\"cName\":\"btnSaveAndAdd\",\"cGroup\":\"toolbaritem\"}]},{\"code\":\"release\",\"condition\":\"data.releasestatus == 0 && mode == 'browse'\",\"items\":[{\"bVisible\":true,\"bEnable\":true,\"cName\":\"btnAbandon\",\"cGroup\":\"toolbaritem\"},{\"bVisible\":true,\"bEnable\":true,\"cName\":\"btnSave\",\"cGroup\":\"toolbaritem\"},{\"bVisible\":true,\"bEnable\":true,\"cName\":\"btnSaveAndAdd\",\"cGroup\":\"toolbaritem\"}]},{\"code\":\"unrelease\",\"condition\":\"(data.releasestatus == 1) && mode == 'browse'\",\"items\":[{\"bVisible\":true,\"bEnable\":true,\"cName\":\"btnSave\",\"cGroup\":\"toolbaritem\"},{\"bVisible\":true,\"bEnable\":true,\"cName\":\"btnSaveAndAdd\",\"cGroup\":\"toolbaritem\"},{\"bVisible\":true,\"bEnable\":true,\"cName\":\"btnAbandon\",\"cGroup\":\"toolbaritem\"}]},{\"code\":\"add\",\"items\":[{\"bVisible\":true,\"bEnable\":true,\"cName\":\"btnSave\",\"cGroup\":\"toolbaritem\"},{\"bVisible\":true,\"bEnable\":true,\"cName\":\"btnAbandon\",\"cGroup\":\"toolbaritem\"},{\"bVisible\":true,\"bEnable\":true,\"cName\":\"btnSaveAndAdd\",\"cGroup\":\"toolbaritem\"}]},{\"code\":\"blank\",\"items\":[{\"bVisible\":false,\"bEnable\":false,\"cName\":\"btnSave\",\"cGroup\":\"toolbaritem\"},{\"bVisible\":false,\"bEnable\":false,\"cName\":\"btnAbandon\",\"cGroup\":\"toolbaritem\"},{\"bVisible\":false,\"bEnable\":false,\"cName\":\"btnSaveAndAdd\",\"cGroup\":\"toolbaritem\"}]}],\n            \n              \n              'params':{\"billType\":\"Archive\",\"primaryKey\":\"id\",\"masterOrgField\":null,\"isCoded\":false,\"domainKey\":\"staffcenter\"},\n            \n              \n              'depends':{},\n            \n          };\n          this.setData(fields);\n          this.setDirty(false);\n\n  \n\n            var billType = \"archive\" || 'voucher';\n            var biz;\n            if (billType == 'option' || billType == 'freeview') {\n              biz = cb.biz.common[billType];\n            } else {\n              biz = cb.biz.common.voucher;\n            }\n\n            \n    //common events start\n    //actions\n    \n      _this.allActions = [{\"cCommand\":\"cmdMovenext\",\"cAction\":\"movenext\",\"cSvcUrl\":\"/bill/movenext\",\"cHttpMethod\":\"GET\",\"cTarget\":\"Browstoolbar\"},{\"cCommand\":\"cmdSaveAndAdd\",\"cAction\":\"saveandadd\",\"cSvcUrl\":\"/bill/save\",\"cHttpMethod\":\"POST\"},{\"cCommand\":\"cmdAbandonBrowst_d\",\"cAction\":\"abandon\",\"cSvcUrl\":\"/bill/abandon\",\"cHttpMethod\":\"GET\"},{\"cCommand\":\"cmdAbandon\",\"cAction\":\"abandon\",\"cSvcUrl\":\"/bill/abandon\",\"cHttpMethod\":\"GET\"},{\"cCommand\":\"cmdAbandonBrowst\",\"cAction\":\"abandon\",\"cSvcUrl\":\"/bill/abandon\",\"cHttpMethod\":\"GET\",\"cTarget\":\"Browstoolbar_left\"},{\"cCommand\":\"cmdDelete\",\"cAction\":\"delete\",\"cSvcUrl\":\"/bill/delete\",\"cHttpMethod\":\"POST\",\"cTarget\":\"Browstoolbar\"},{\"cCommand\":\"cmdMoveprev\",\"cAction\":\"moveprev\",\"cSvcUrl\":\"/bill/moveprev\",\"cHttpMethod\":\"GET\",\"cTarget\":\"Browstoolbar\"},{\"cCommand\":\"cmdEdit\",\"cAction\":\"Edit\",\"cSvcUrl\":\"/bill/edit\",\"cHttpMethod\":\"GET\",\"cTarget\":\"Browstoolbar\"},{\"cCommand\":\"cmdGetRefData\",\"cAction\":\"getRefData\",\"cSvcUrl\":\"/membercenter/bill/getrefdata\",\"cHttpMethod\":\"POST\"},{\"cCommand\":\"cmdSave\",\"cAction\":\"save\",\"cSvcUrl\":\"/bill/save\",\"cHttpMethod\":\"POST\"}];\n    \n    \n      \n          \n          _this.get('btnSaveAndAdd').on('click',function(params){\n            var args = cb.utils.extend(true, {}, {\"cCommand\":\"cmdSaveAndAdd\",\"cAction\":\"saveandadd\",\"cSvcUrl\":\"/bill/save\",\"cHttpMethod\":\"POST\",\"cItemName\":\"btnSaveAndAdd\",\"cCaption\":\"保存并新增\",\"cCaptionResid\":\"P_YS_FED_UCFBASEDOC_0000024712\",\"cShowCaption\":\"保存并新增\",\"cShowCaptionResid\":\"P_YS_FED_UCFBASEDOC_0000024712\",\"bEnum\":false,\"cControlType\":\"primarybutton\",\"iStyle\":1,\"bVmExclude\":0,\"iOrder\":0,\"uncopyable\":false,\"bEnableFormat\":false,\"key\":\"34659315952\",\"domainKey\":\"staffcenter\",\"needClear\":false}, { key: 'btnSaveAndAdd'},{ params: params });\n            args.cShowCaption = this._get_data('cShowCaption');\n            args.cCaption = this._get_data('cCaption');\n            \n            var self = this;\n            args.disabledCallback = function () {\n              self.setDisabled(true);\n            }\n            args.enabledCallback = function () {\n              self.setDisabled(false);\n            }\n            \n            biz.do('saveandadd',_this, args)\n          });\n      \n          \n          _this.get('btnAbandon').on('click',function(params){\n            var args = cb.utils.extend(true, {}, {\"cCommand\":\"cmdAbandon\",\"cAction\":\"abandon\",\"cSvcUrl\":\"/bill/abandon\",\"cHttpMethod\":\"GET\",\"cItemName\":\"btnAbandon\",\"cCaption\":\"取消\",\"cCaptionResid\":\"P_YS_FED_EXAMP_0000020385\",\"cShowCaption\":\"取消\",\"cShowCaptionResid\":\"P_YS_FED_EXAMP_0000020385\",\"bEnum\":false,\"cControlType\":\"button\",\"iStyle\":1,\"bVmExclude\":0,\"iOrder\":0,\"uncopyable\":false,\"bEnableFormat\":false,\"key\":\"34659315953\",\"domainKey\":\"staffcenter\",\"needClear\":false}, { key: 'btnAbandon'},{ params: params });\n            args.cShowCaption = this._get_data('cShowCaption');\n            args.cCaption = this._get_data('cCaption');\n            \n            var self = this;\n            args.disabledCallback = function () {\n              self.setDisabled(true);\n            }\n            args.enabledCallback = function () {\n              self.setDisabled(false);\n            }\n            \n            biz.do('abandon',_this, args)\n          });\n      \n          \n          _this.get('btnSave').on('click',function(params){\n            var args = cb.utils.extend(true, {}, {\"cCommand\":\"cmdSave\",\"cAction\":\"save\",\"cSvcUrl\":\"/bill/save\",\"cHttpMethod\":\"POST\",\"cItemName\":\"btnSave\",\"cCaption\":\"保存\",\"cCaptionResid\":\"P_YS_PF_GZTSYS_0000013477\",\"cShowCaption\":\"保存\",\"cShowCaptionResid\":\"P_YS_PF_GZTSYS_0000013477\",\"bEnum\":false,\"cControlType\":\"primarybutton\",\"iStyle\":1,\"bVmExclude\":0,\"iOrder\":0,\"uncopyable\":false,\"bEnableFormat\":false,\"key\":\"34659315951\",\"domainKey\":\"staffcenter\",\"needClear\":false}, { key: 'btnSave'},{ params: params });\n            args.cShowCaption = this._get_data('cShowCaption');\n            args.cCaption = this._get_data('cCaption');\n            \n            var self = this;\n            args.disabledCallback = function () {\n              self.setDisabled(true);\n            }\n            args.enabledCallback = function () {\n              self.setDisabled(false);\n            }\n            \n            biz.do('save',_this, args)\n          });\n      \n    \n    \n      //check\n      \n    \n\n    _this.on('columnSetting',function(params){\n      biz.do('columnSetting',_this,params);\n    });\n    //common events end\n  \n            \n    // common billitem events start\n    // events\n    \n    \n      \n    \n    //common billitem events end\n  \n\n            var girdModelKeys = []\n            if(girdModelKeys){\n              girdModelKeys.forEach(function(key){\n                var gridModel = _this.get(key);\n                if(gridModel){\n                  gridModel.on('afterCellValueChange',function(params){\n                    if(params) params.childrenField = key;\n                    biz.do('cellCheck',_this, params);\n                  })\n                }\n              })\n            }\n            \n            //注册\n            _this.on('filterClick',function(params){\n              biz.do('search',_this,params);\n            });\n            \n      \n\n      this.biz = biz;\n      // this.initData();\n    };\n      model.prototype.initData = function () {\n        // if(cb.biz['staff'] && cb.biz['staff']['staff_duty_VM_Extend']){\n        //   console.info('%c staff_duty_VM_Extend extendjs doAction', 'color:green');\n        //   cb.biz['staff']['staff_duty_VM_Extend'].doAction(\"init\", this);\n        // }else{\n        //   console.log('%c no extend js' , 'font-size:22pt;color:red');\n        // }\n        var self = this;\n        var extendFile = 'staff/staff_duty_VM.Extend.js';\n        cb.require('staffcenter', [extendFile], function (extend){\n          if (extend && extend.doAction) {\n            console.info('%c staff_duty_VM_Extend extendjs doAction', 'color:green');\n            // 处理扩展脚本异常导致渲染失败 yueming\n            try {\n                // 临时切换到lazyExecute\n                cb.models.BaseModel.prototype.lazyExecuteMode = true\n                extend.doAction(\"init\", self);\n                // 再切换回来\n                cb.models.BaseModel.prototype.lazyExecuteMode = false\n            } catch (error) {\n                console.error('Exception in business script, please check');\n                console.error(error);\n            }\n          } else {\n            console.error('%c 语法错误  ' + extendFile , 'font-size:12pt;color:#860786');\n            console.error('%c extendVmName-->staff_duty_VM_Extend','font-size:12pt;color:#860786')\n          }\n          self.execute('extendReady',self);\n        }, function(error){\n          console.info('%c 未找到  ' + extendFile , 'font-size:12pt;color:#860786');\n          console.info('%c extendVmName-->staff_duty_VM_Extend','font-size:12pt;color:#860786')\n          self.execute('extendReady',self);\n        });\n     };\n\n    return model;\n  });\n\n  \n    "
  }
}